{
  "mainText": "Hay mesas que suceden dentro de nuestros espacios.Otras nos llaman a formar parte de ellas.",
  "secondaryText": "Juntos creamos encuentros donde la cocina, el servicio y la atmósfera se alinean para celebrar lo que realmente importa: las personas que se reúnen alrededor de tu mesa.",
  "image1": {
    "url": "",
    "alt": ""
  },
  "image2": {
    "url": "",
    "alt": ""
  },
  "image3": {
    "url": "",
    "alt": ""
  }
}
